{
  "schema_version": 1,
  "region": "ap-southeast-1",
  "as_of": "2026-10-19",
  "currency": "USD",
  "basis": "gross_model_before_tax_credits_free_tier",
  "sources": {
    "s3": {
      "url": "https://aws.amazon.com/s3/pricing/",
      "retrieved_at": "2026-10-19",
      "kind": "official_page"
    },
    "ddb": {
      "url": "https://aws.amazon.com/dynamodb/pricing/",
      "retrieved_at": "2026-10-19",
      "kind": "official_page"
    },
    "ec2": {
      "url": "https://aws.amazon.com/ec2/pricing/on-demand/",
      "retrieved_at": "2026-10-19",
      "kind": "official_page"
    },
    "ebs": {
      "url": "https://aws.amazon.com/ebs/pricing/",
      "retrieved_at": "2026-10-19",
      "kind": "official_page"
    },
    "kms": {
      "url": "https://aws.amazon.com/kms/pricing/",
      "retrieved_at": "2026-10-19",
      "kind": "official_page"
    },
    "secrets": {
      "url": "https://aws.amazon.com/secrets-manager/pricing/",
      "retrieved_at": "2026-10-19",
      "kind": "official_page"
    },
    "cloudwatch": {
      "url": "https://aws.amazon.com/cloudwatch/pricing/",
      "retrieved_at": "2026-10-19",
      "kind": "official_page"
    },
    "vpc": {
      "url": "https://aws.amazon.com/vpc/pricing/",
      "retrieved_at": "2026-10-19",
      "kind": "official_page"
    },
    "elb": {
      "url": "https://aws.amazon.com/elasticloadbalancing/pricing/",
      "retrieved_at": "2026-10-19",
      "kind": "official_page"
    },
    "ssm": {
      "url": "https://aws.amazon.com/systems-manager/pricing/",
      "retrieved_at": "2026-10-19",
      "kind": "official_page"
    },
    "api": {
      "url": "https://docs.aws.amazon.com/aws-cost-management/latest/APIReference/API_pricing_GetProducts.html",
      "retrieved_at": "2026-10-19",
      "kind": "aws_price_api"
    }
  },
  "storage_rules": [
    {
      "class": "STANDARD",
      "minimum_days": 0,
      "minimum_billable_bytes": 0,
      "metadata_standard_bytes": 0,
      "metadata_archive_bytes": 0,
      "source_id": "s3"
    },
    {
      "class": "STANDARD_IA",
      "minimum_days": 30,
      "minimum_billable_bytes": 131072,
      "metadata_standard_bytes": 0,
      "metadata_archive_bytes": 0,
      "source_id": "s3"
    },
    {
      "class": "GLACIER_IR",
      "minimum_days": 90,
      "minimum_billable_bytes": 131072,
      "metadata_standard_bytes": 0,
      "metadata_archive_bytes": 0,
      "source_id": "s3"
    },
    {
      "class": "GLACIER",
      "minimum_days": 90,
      "minimum_billable_bytes": 0,
      "metadata_standard_bytes": 8192,
      "metadata_archive_bytes": 32768,
      "source_id": "s3"
    }
  ],
  "rates": [
    {
      "id": "s3.storage.standard",
      "category": "storage",
      "service": "AmazonS3",
      "unit": "GB-Mo",
      "status": "verified",
      "source_id": "api",
      "dimensions": {
        "location": "Asia Pacific (Singapore)",
        "usagetype": "APS1-TimedStorage-ByteHrs",
        "operation": "",
        "volumeType": "Standard",
        "sku": "M6MTARCQFUQBQ2V3",
        "regionCode": "ap-southeast-1"
      },
      "tiers": [
        {
          "begin": "0",
          "end": "51200",
          "usd": "0.0250000000"
        },
        {
          "begin": "51200",
          "end": "512000",
          "usd": "0.0240000000"
        },
        {
          "begin": "512000",
          "end": null,
          "usd": "0.0230000000"
        }
      ],
      "note": "Archive packs, dead bytes and control objects accounted by actual class/byte-time."
    },
    {
      "id": "s3.storage.standard_ia",
      "category": "storage",
      "service": "AmazonS3",
      "unit": "GB-Mo",
      "status": "verified",
      "source_id": "api",
      "dimensions": {
        "location": "Asia Pacific (Singapore)",
        "usagetype": "APS1-TimedStorage-SIA-ByteHrs",
        "operation": "",
        "volumeType": "Standard - Infrequent Access",
        "sku": "VRNEADAH39YMA2GG",
        "regionCode": "ap-southeast-1"
      },
      "tiers": [
        {
          "begin": "0",
          "end": null,
          "usd": "0.0138000000"
        }
      ],
      "note": "Archive packs, dead bytes and control objects accounted by actual class/byte-time."
    },
    {
      "id": "s3.storage.glacier_ir",
      "category": "storage",
      "service": "AmazonS3",
      "unit": "GB-Mo",
      "status": "verified",
      "source_id": "api",
      "dimensions": {
        "location": "Asia Pacific (Singapore)",
        "usagetype": "APS1-TimedStorage-GIR-ByteHrs",
        "operation": "",
        "volumeType": "Glacier Instant Retrieval",
        "sku": "UVQY45BSCBGNAH94",
        "regionCode": "ap-southeast-1"
      },
      "tiers": [
        {
          "begin": "0",
          "end": null,
          "usd": "0.0050000000"
        }
      ],
      "note": "Archive packs, dead bytes and control objects accounted by actual class/byte-time."
    },
    {
      "id": "s3.storage.glacier",
      "category": "storage",
      "service": "AmazonS3",
      "unit": "GB-Mo",
      "status": "verified",
      "source_id": "api",
      "dimensions": {
        "location": "Asia Pacific (Singapore)",
        "usagetype": "APS1-TimedStorage-GlacierByteHrs",
        "operation": "",
        "volumeType": "Amazon Glacier",
        "sku": "FSCSS6TRWM9N2ZE7",
        "regionCode": "ap-southeast-1"
      },
      "tiers": [
        {
          "begin": "0",
          "end": null,
          "usd": "0.0045000000"
        }
      ],
      "note": "Archive packs, dead bytes and control objects accounted by actual class/byte-time."
    },
    {
      "id": "s3.put_standard",
      "category": "request",
      "service": "AmazonS3",
      "unit": "Requests",
      "status": "verified",
      "source_id": "api",
      "dimensions": {
        "location": "Asia Pacific (Singapore)",
        "usagetype": "APS1-Requests-Tier1",
        "operation": "",
        "volumeType": "",
        "sku": "VHRJWKRHEA6VHEFY",
        "regionCode": "ap-southeast-1"
      },
      "tiers": [
        {
          "begin": "0",
          "end": null,
          "usd": "0.0000050000"
        }
      ],
      "note": "Use exact operation/class; include retries, controls and full-pack retrieval."
    },
    {
      "id": "s3.get_standard",
      "category": "request",
      "service": "AmazonS3",
      "unit": "Requests",
      "status": "verified",
      "source_id": "api",
      "dimensions": {
        "location": "Asia Pacific (Singapore)",
        "usagetype": "APS1-Requests-Tier2",
        "operation": "",
        "volumeType": "",
        "sku": "T469UNPYX78434EG",
        "regionCode": "ap-southeast-1"
      },
      "tiers": [
        {
          "begin": "0",
          "end": null,
          "usd": "0.0000004000"
        }
      ],
      "note": "Use exact operation/class; include retries, controls and full-pack retrieval."
    },
    {
      "id": "s3.retrieval_ia",
      "category": "retrieval",
      "service": "AmazonS3",
      "unit": "GB",
      "status": "verified",
      "source_id": "api",
      "dimensions": {
        "location": "Asia Pacific (Singapore)",
        "usagetype": "APS1-Retrieval-SIA",
        "operation": "",
        "volumeType": "",
        "sku": "XG62Y5XDMRTKEN2C",
        "regionCode": "ap-southeast-1"
      },
      "tiers": [
        {
          "begin": "0",
          "end": null,
          "usd": "0.0100000000"
        }
      ],
      "note": "Use exact operation/class; include retries, controls and full-pack retrieval."
    },
    {
      "id": "s3.retrieval_ir",
      "category": "retrieval",
      "service": "AmazonS3",
      "unit": "GB",
      "status": "verified",
      "source_id": "api",
      "dimensions": {
        "location": "Asia Pacific (Singapore)",
        "usagetype": "APS1-Retrieval-GIR",
        "operation": "",
        "volumeType": "",
        "sku": "FNZRW975QWGYKZSN",
        "regionCode": "ap-southeast-1"
      },
      "tiers": [
        {
          "begin": "0",
          "end": null,
          "usd": "0.0300000000"
        }
      ],
      "note": "Use exact operation/class; include retries, controls and full-pack retrieval."
    },
    {
      "id": "s3.restore_standard_gb",
      "category": "restore",
      "service": "AmazonS3",
      "unit": "GB",
      "status": "verified",
      "source_id": "api",
      "dimensions": {
        "location": "Asia Pacific (Singapore)",
        "usagetype": "APS1-Standard-Retrieval-Bytes",
        "operation": "RestoreObject",
        "volumeType": "",
        "sku": "PB2B932AJF8NJW49",
        "regionCode": "ap-southeast-1"
      },
      "tiers": [
        {
          "begin": "0",
          "end": null,
          "usd": "0.0120000000"
        }
      ],
      "note": "Use exact operation/class; include retries, controls and full-pack retrieval."
    },
    {
      "id": "s3.put_ia",
      "category": "request",
      "service": "AmazonS3",
      "unit": "Requests",
      "status": "verified",
      "source_id": "api",
      "dimensions": {
        "location": "Asia Pacific (Singapore)",
        "usagetype": "APS1-Requests-SIA-Tier1",
        "operation": "",
        "volumeType": "",
        "sku": "U8VT25APWDB8S2HZ",
        "regionCode": "ap-southeast-1"
      },
      "tiers": [
        {
          "begin": "0",
          "end": null,
          "usd": "0.0000100000"
        }
      ],
      "note": "PUT/COPY/POST in Standard-IA."
    },
    {
      "id": "s3.put_ir",
      "category": "request",
      "service": "AmazonS3",
      "unit": "Requests",
      "status": "verified",
      "source_id": "api",
      "dimensions": {
        "location": "Asia Pacific (Singapore)",
        "usagetype": "APS1-Requests-GIR-Tier1",
        "operation": "",
        "volumeType": "",
        "sku": "S999S3RRGVTGYCMR",
        "regionCode": "ap-southeast-1"
      },
      "tiers": [
        {
          "begin": "0",
          "end": null,